{
  "domain": "prescription-investigation",
  "log_version": 1,
  "case_id": "YB-2026-051X",
  "events": [
    {
      "seq": 0,
      "timestamp": "2026-03-01T09:00:00+08:00",
      "actor": "review-zheng",
      "kind": "case_opened",
      "payload": {
        "case_id": "YB-2026-051X",
        "title": "异常开药及疑似转售调查（虚构示例）"
      },
      "prev_hash": "GENESIS",
      "hash": "6435b4387f281f5007aa91c3938d2f26590a34622391e9a87d99b3f6398882a8"
    },
    {
      "seq": 1,
      "timestamp": "2026-03-02T10:00:00+08:00",
      "actor": "lead-zhou",
      "kind": "subject_registered",
      "payload": {
        "subject_id": "S-01",
        "label": "张甲（虚构化名）",
        "role": "疑似违规参保人",
        "note": "同日开药疑点名单对象"
      },
      "prev_hash": "6435b4387f281f5007aa91c3938d2f26590a34622391e9a87d99b3f6398882a8",
      "hash": "a6804795a213ba50383c8bff687d60cc279bb77fd32642e9d3018f3b6d60e8d4"
    },
    {
      "seq": 2,
      "timestamp": "2026-03-02T10:05:00+08:00",
      "actor": "lead-zhou",
      "kind": "subject_registered",
      "payload": {
        "subject_id": "S-02",
        "label": "李乙（虚构化名）",
        "role": "疑似收药转卖人",
        "note": ""
      },
      "prev_hash": "a6804795a213ba50383c8bff687d60cc279bb77fd32642e9d3018f3b6d60e8d4",
      "hash": "f5511f57303ccf395f2d21560ac02cd324f491da00a805c959d7bc473e390136"
    },
    {
      "seq": 3,
      "timestamp": "2026-03-02T10:10:00+08:00",
      "actor": "lead-zhou",
      "kind": "subject_registered",
      "payload": {
        "subject_id": "S-03",
        "label": "王丙（虚构化名）",
        "role": "需排除的同日开药患者",
        "note": ""
      },
      "prev_hash": "f5511f57303ccf395f2d21560ac02cd324f491da00a805c959d7bc473e390136",
      "hash": "7a0cadd2ecb05e16ff710e69cc6694414124fd349e9999a4524f83227a1c707a"
    },
    {
      "seq": 4,
      "timestamp": "2026-03-02T11:00:00+08:00",
      "actor": "lead-zhou",
      "kind": "hypothesis_registered",
      "payload": {
        "hypothesis_id": "H-01",
        "statement": "张甲疑似长期超量开取降糖药 X，经李乙回收并转售外地",
        "subject_ids": [
          "S-01",
          "S-02"
        ],
        "basis": "同日开药疑点名单仅为线索，需多源材料印证"
      },
      "prev_hash": "7a0cadd2ecb05e16ff710e69cc6694414124fd349e9999a4524f83227a1c707a",
      "hash": "549ea0a31a15de68c9f893d793fadbc336720baa6171bb72244f53d19f56841c"
    },
    {
      "seq": 5,
      "timestamp": "2026-03-03T09:30:00+08:00",
      "actor": "review-zheng",
      "kind": "authorization_granted",
      "payload": {
        "authorization_id": "AUTH-01",
        "categories": [
          "settlement",
          "surveillance"
        ],
        "teams": [
          "lead",
          "surveillance"
        ],
        "valid_from": "2026-03-01T00:00:00+08:00",
        "valid_to": "2026-06-30T23:59:59+08:00",
        "min_stage": "initial",
        "basis": "初查阶段核实取药人与结算人身份",
        "supplemental_of": null
      },
      "prev_hash": "549ea0a31a15de68c9f893d793fadbc336720baa6171bb72244f53d19f56841c",
      "hash": "4c4e5b48378d958220cadad4cf7e64caca80ff503cae23afc2d73a6029ad80c6"
    },
    {
      "seq": 6,
      "timestamp": "2026-03-05T15:00:00+08:00",
      "actor": "lead-zhou",
      "kind": "material_registered",
      "payload": {
        "material_id": "M-SETTLE-01",
        "category": "settlement",
        "title": "张甲 2024-2026 年结算明细（虚构导出）",
        "source": "市医保平台结算库（虚构）",
        "obtained_at": "2026-03-05T14:00:00+08:00",
        "checksum": "sha256:0de1ee8109c09c68add054ae359f7b46895db7fad52e0f3621773696d613db67",
        "authorization_id": "AUTH-01",
        "collected_by": "lead",
        "custodian": "证据室/线索组保管柜",
        "hypothesis_ids": [
          "H-01"
        ]
      },
      "prev_hash": "4c4e5b48378d958220cadad4cf7e64caca80ff503cae23afc2d73a6029ad80c6",
      "hash": "67a4add520455ef1477e76a80058d8e07325bad850c120441055d30b069d72f5"
    },
    {
      "seq": 7,
      "timestamp": "2026-03-05T15:05:00+08:00",
      "actor": "lead-zhou",
      "kind": "material_registered",
      "payload": {
        "material_id": "M-SETTLE-02",
        "category": "settlement",
        "title": "王丙 2026-03-05 同日结算记录（虚构导出）",
        "source": "市医保平台结算库（虚构）",
        "obtained_at": "2026-03-05T14:05:00+08:00",
        "checksum": "sha256:b06fa7ca79a273700a6cbae4cf7230e150470d43562a1b29e81c0edabe7ad21e",
        "authorization_id": "AUTH-01",
        "collected_by": "lead",
        "custodian": "证据室/线索组保管柜",
        "hypothesis_ids": [
          "H-01"
        ]
      },
      "prev_hash": "67a4add520455ef1477e76a80058d8e07325bad850c120441055d30b069d72f5",
      "hash": "8c37be58e3447d3fa49eb9a599e9ddecf5b840125edbdc993d549459f97a6324"
    },
    {
      "seq": 8,
      "timestamp": "2026-03-06T11:00:00+08:00",
      "actor": "surveillance-wu",
      "kind": "material_registered",
      "payload": {
        "material_id": "M-VIDEO-01",
        "category": "surveillance",
        "title": "2026-03-05 门诊取药窗口监控片段（虚构）",
        "source": "某医院安防室（虚构）",
        "obtained_at": "2026-03-06T10:00:00+08:00",
        "checksum": "sha256:678a142ac1598904aece6b5ca3e864e00bfa75411ee05c5db9f7ca7e3f7d2660",
        "authorization_id": "AUTH-01",
        "collected_by": "surveillance",
        "custodian": "证据室/监控组保管柜",
        "hypothesis_ids": [
          "H-01"
        ]
      },
      "prev_hash": "8c37be58e3447d3fa49eb9a599e9ddecf5b840125edbdc993d549459f97a6324",
      "hash": "1a574d7a0a7331ea747c0fb88b0359a726dd7264711b4c208e0129748d2b2b35"
    },
    {
      "seq": 9,
      "timestamp": "2026-03-07T09:00:00+08:00",
      "actor": "surveillance-wu",
      "kind": "candidate_link_proposed",
      "payload": {
        "link_id": "L-01",
        "material_a": "M-VIDEO-01",
        "material_b": "M-SETTLE-01",
        "link_kind": "identity",
        "basis": "画面取药时间窗与张甲结算时间相差 3 分钟，体貌特征初判一致",
        "confidence": 0.82
      },
      "prev_hash": "1a574d7a0a7331ea747c0fb88b0359a726dd7264711b4c208e0129748d2b2b35",
      "hash": "645289d4667aa758f86f15d47a078b44ae2cd8282e0122e5ddc4988bd24cd2a8"
    },
    {
      "seq": 10,
      "timestamp": "2026-03-07T09:05:00+08:00",
      "actor": "surveillance-wu",
      "kind": "candidate_link_proposed",
      "payload": {
        "link_id": "L-02",
        "material_a": "M-VIDEO-01",
        "material_b": "M-SETTLE-02",
        "link_kind": "identity",
        "basis": "同日另有王丙结算记录，系统按同药同日推送的候选，需人工排除",
        "confidence": 0.31
      },
      "prev_hash": "645289d4667aa758f86f15d47a078b44ae2cd8282e0122e5ddc4988bd24cd2a8",
      "hash": "80d671cb005fd69da045eb67ef3cfe024fd33735a21f7b5254906be5d9e4f59e"
    },
    {
      "seq": 11,
      "timestamp": "2026-03-08T14:00:00+08:00",
      "actor": "review-zheng",
      "kind": "identity_reviewed",
      "payload": {
        "link_id": "L-02",
        "verdict": "rejected",
        "reason": "王丙当日持本人处方在另一窗口取药，衣着与影像不符，排除"
      },
      "prev_hash": "80d671cb005fd69da045eb67ef3cfe024fd33735a21f7b5254906be5d9e4f59e",
      "hash": "5581f8a95d280e080ddae2c1eeb19ef665aecbcb13308aeaf8421052f901949a"
    },
    {
      "seq": 12,
      "timestamp": "2026-03-08T14:30:00+08:00",
      "actor": "review-zheng",
      "kind": "identity_reviewed",
      "payload": {
        "link_id": "L-01",
        "verdict": "confirmed",
        "reason": "结合挂号抓拍与取药签字，确认监控取药人即张甲本人"
      },
      "prev_hash": "5581f8a95d280e080ddae2c1eeb19ef665aecbcb13308aeaf8421052f901949a",
      "hash": "b91f9a377033d74b6dfe4cf57c6b6d2dd996355350d1e1abe595b4ad621ce6a1"
    },
    {
      "seq": 13,
      "timestamp": "2026-03-09T10:00:00+08:00",
      "actor": "review-zheng",
      "kind": "lead_escalated",
      "payload": {
        "hypothesis_id": "H-01",
        "reason": "结算异常与取药监控经复核指向同一人，具备正式调查必要"
      },
      "prev_hash": "b91f9a377033d74b6dfe4cf57c6b6d2dd996355350d1e1abe595b4ad621ce6a1",
      "hash": "8b3f676f130bb4deb5cb91291bb41c634546fffc7193622c862cadc26ce85b9a"
    },
    {
      "seq": 14,
      "timestamp": "2026-04-03T11:00:00+08:00",
      "actor": "surveillance-wu",
      "kind": "material_registered",
      "payload": {
        "material_id": "M-VIDEO-02",
        "category": "surveillance",
        "title": "2026-04-02 取药窗口监控片段（虚构）",
        "source": "某医院安防室（虚构）",
        "obtained_at": "2026-04-03T10:00:00+08:00",
        "checksum": "sha256:0f8122a5af3a345287a9ab77e03b7e9dd9dab40301b0a015a1c84e4857a3746f",
        "authorization_id": "AUTH-01",
        "collected_by": "surveillance",
        "custodian": "证据室/监控组保管柜",
        "hypothesis_ids": [
          "H-01"
        ]
      },
      "prev_hash": "8b3f676f130bb4deb5cb91291bb41c634546fffc7193622c862cadc26ce85b9a",
      "hash": "6b39f478640842df9d0c7ab288d17c21d5e3db900cbea82f813e87e9ed4c185b"
    },
    {
      "seq": 15,
      "timestamp": "2026-04-04T09:00:00+08:00",
      "actor": "surveillance-wu",
      "kind": "candidate_link_proposed",
      "payload": {
        "link_id": "L-03",
        "material_a": "M-VIDEO-02",
        "material_b": "M-SETTLE-01",
        "link_kind": "identity",
        "basis": "4 月 2 日片段中取药人疑似张甲，待与当月结算明细比对",
        "confidence": 0.64
      },
      "prev_hash": "6b39f478640842df9d0c7ab288d17c21d5e3db900cbea82f813e87e9ed4c185b",
      "hash": "0d88ceac3236a8707f532382db7b65752d4cad33e7ddd4ce541c4b9d994d7f6e"
    },
    {
      "seq": 16,
      "timestamp": "2026-03-10T16:00:00+08:00",
      "actor": "surveillance-wu",
      "kind": "parallel_analysis",
      "payload": {
        "analysis_id": "A-01",
        "team": "surveillance",
        "material_ids": [
          "M-VIDEO-01"
        ],
        "summary": "取药人面部与步态特征摘录，供复核使用",
        "confirms": [
          "L-01"
        ]
      },
      "prev_hash": "0d88ceac3236a8707f532382db7b65752d4cad33e7ddd4ce541c4b9d994d7f6e",
      "hash": "f0ee2294e358f766edc976a4cc5c019a936cdb62894442eb5d24931d7b5e4e15"
    },
    {
      "seq": 17,
      "timestamp": "2026-03-10T16:20:00+08:00",
      "actor": "lead-zhou",
      "kind": "parallel_analysis",
      "payload": {